Rule_number,Text,Topic,Character_count
67.0,"Financial assets shall be broken down by accounting portfolio and instrument and – where required – by counterparty. For debt instruments measured at fair value through other comprehensive income and at amortised cost, the gross carrying amount of assets and accumulated impairments shall be broken down by impairment stages.",BREAKDOWN OF FINANCIAL ASSETS BY INSTRUMENT AND BY COUNTERPARTY SECTOR,325
68.0,Derivatives reported as trading financial assets under GAAP based on BAD include instruments measured at fair value as well as instruments measured at cost-based methods or LOCOM.,BREAKDOWN OF FINANCIAL ASSETS BY INSTRUMENT AND BY COUNTERPARTY SECTOR,179
69.0,"For the purposes of Annexes III and IV as well as this Annex, ‘accumulated negative changes in fair value due to credit risk’ means, for non-performing exposures, accumulated changes in fair value due to credit risk where the accumulated net change is negative. The accumulated net change in fair value due to credit risk shall be calculated by adding all negative and positive changes in fair value due to credit risk that have occurred since recognition of the debt instrument. This amount shall only be reported if the addition of positive and negative changes in fair value due to credit risk results in a negative amount. The valuation of the debt instruments shall be performed on the level of single financial instruments. For each debt instrument, ‘Accumulated negative changes in fair value due to credit risk’ shall be reported until the derecognition of the instrument.",BREAKDOWN OF FINANCIAL ASSETS BY INSTRUMENT AND BY COUNTERPARTY SECTOR,880
70.0,"For the purposes of Annexes III and IV as well as this Annex, ‘accumulated impairment’ shall have the following meaning:
(a) for debt instruments measured at amortised cost or at a cost-based method, accumulated impairment is the cumulative amount of impairment losses, net of use and reversals that has been recognised, where appropriate for each of the impairment stages. Accumulated impairment reduces the carrying amount of the debt instrument through the use of an allowance account under IFRS and national GAAP based on BAD, or via direct reductions that do not constitute a derecognition event under national GAAP based on BAD;
(b) for debt instruments measured at fair value through other comprehensive income under IFRS, accumulated impairment is the sum of expected credit losses and their variations recognised as a reduction of fair value on a given instrument since initial recognition;
(c) for debt instruments at fair value through equity under national GAAP based on BAD subject to impairment, accumulated impairment is the cumulative amount of impairment losses, net of use and reversals that has been recognised. The reduction in the carrying amount is either made through use of an allowance account or via direct reductions that do not constitute a derecognition event.",BREAKDOWN OF FINANCIAL ASSETS BY INSTRUMENT AND BY COUNTERPARTY SECTOR,1289
71.0,"Under IFRS, accumulated impairment shall include the allowance for expected credit losses for financial assets under each of the impairment stages specified by IFRS 9. Under national GAAP based on BAD, it shall include specific and general allowance for credit risk, as well as the general allowance for banking risk where it reduces the carrying amount of debt instruments. Accumulated impairment shall also include the credit risk-induced value adjustments on financial assets under LOCOM.",BREAKDOWN OF FINANCIAL ASSETS BY INSTRUMENT AND BY COUNTERPARTY SECTOR,491
72.0,"‘Accumulated partial write-offs’ and ‘Accumulated total write-offs’ shall include, respectively, the accumulated partial and total amount as at the reference date of principal and accrued past due interest and fees of any debt instrument that has been de-recognised to date using either of the methods described in paragraph 74 because the institution has no reasonable expectations of recovering the contractual cash flows. These amounts shall be reported until the total extinguishment of all the reporting institution’s rights by expiry of the statute-of-limitations period, forgiveness or other causes, or until recovery. Therefore where the written-off amounts are not recovered, they shall be reported while they are subject to enforcement activities.",BREAKDOWN OF FINANCIAL ASSETS BY INSTRUMENT AND BY COUNTERPARTY SECTOR,757
73.0,"Where a debt instrument is eventually totally written-off as a consequence of successive partial write-offs, the cumulative amount written-off shall be reclassified from the ‘Accumulated partial write-offs’ into the ‘Accumulated total write-offs’ column.",BREAKDOWN OF FINANCIAL ASSETS BY INSTRUMENT AND BY COUNTERPARTY SECTOR,254
74.0,"Write-offs shall constitute a derecognition event and relate to a financial asset in its entirety or to a portion of it, including where the modification of an asset leads the institution to give up its right of collecting cash flows on a portion or the entirety of this asset as further explained in paragraph 72. Write-offs shall include amounts caused both by reductions of the carrying amount of financial assets recognised directly in profit or loss as well as reductions in the amounts of the allowance accounts for credit losses taken against the carrying amount of financial assets.",BREAKDOWN OF FINANCIAL ASSETS BY INSTRUMENT AND BY COUNTERPARTY SECTOR,590
75.0,The column ‘of which: Instruments with low credit risk’ shall include instruments that are determined to have low credit risk at the reporting date and for which the institution assumes that the credit risk has not increased significantly since initial recognition in accordance with IFRS 9.5.5.10.,BREAKDOWN OF FINANCIAL ASSETS BY INSTRUMENT AND BY COUNTERPARTY SECTOR,298
76.0,"Trade receivables within the meaning of IAS 1.54(h), contract assets and lease receivables for which the simplified approach of IFRS 9.5.5.15 for the estimation of loss allowances has been applied shall be reported within loans and advances in template 4.4.1. The corresponding loss allowance for those assets shall be reported in either ‘Accumulated impairment on assets with significant increase in credit risk since initial recognition but not credit-impaired (Stage 2)’ or ‘Accumulated impairment on credit-impaired assets (Stage 3)’,depending on whether trade receivables, contract assets or lease receivables under the simplified approach are considered as credit-impaired assets.",BREAKDOWN OF FINANCIAL ASSETS BY INSTRUMENT AND BY COUNTERPARTY SECTOR,686
77.0,"Purchased or originated financial assets that are credit-impaired at initial recognition as defined in IFRS 9 Appendix A shall be separately reported in templates 4.3.1 and 4.4.1. For these assets, the accumulated impairment shall only include the cumulative changes in lifetime expected credit losses since initial recognition [IFRS 9.5.5.13]. The corresponding gross carrying amount and accumulated impairment for these assets shall be reported in ‘Credit-impaired assets (Stage 3)’ at initial recognition and as long as they are considered as credit-impaired assets in accordance with the definition of ‘credit-impaired financial assets’ of IFRS 9 Appendix A. When they are not anymore considered as credit-impaired assets after initial recognition, they shall be reported in ‘Assets with significant increase in credit risk since initial recognition but not credit-impaired (Stage 2)’.",BREAKDOWN OF FINANCIAL ASSETS BY INSTRUMENT AND BY COUNTERPARTY SECTOR,889
78.0,In template 4.5 institutions shall report the carrying amount of ‘Loans and advances’ and ‘Debt securities’ that fall within the definition of ‘subordinated debt’ in paragraph 100 of this Part.,BREAKDOWN OF FINANCIAL ASSETS BY INSTRUMENT AND BY COUNTERPARTY SECTOR,193
79.0,"In template 4.8, information to be reported depends on whether Non-trading non-derivative financial assets measured at fair value to equity can be subject to impairment requirements in application of the national GAAP based on BAD. Where these financial assets are subject to impairment, institutions shall report information in this template that relates to the carrying amount, the gross carrying amount of unimpaired assets and impaired assets, accumulated impairment and accumulated write-offs. Where these financial assets are not subject to impairment, institutions shall report the accumulated negative changes in fair value due to credit risk for non-performing exposures.",BREAKDOWN OF FINANCIAL ASSETS BY INSTRUMENT AND BY COUNTERPARTY SECTOR,680
80.0,"In template 4.9, financial assets measured under moderate LOCOM and their associated value adjustments shall be identified separately from other financial assets measured at a cost-based method and their associated impairment. Financial assets under a cost-based method, including financial assets under moderate LOCOM, shall be reported as unimpaired assets where they have no value adjustments or impairment associated with them, and as impaired assets in case they have value adjustments that qualify as impairment or impairment associated with them. Value adjustments that qualify as impairment shall be credit risk-induced value adjustments reflecting the deterioration of the creditworthiness of the counterparty. Financial assets under moderate LOCOM with market-risk induced value adjustments reflecting the impact of changes in the market conditions on the value of the asset shall not be considered as impaired. Accumulated credit-risk induced and market-risk induced value adjustments shall be reported separately.",BREAKDOWN OF FINANCIAL ASSETS BY INSTRUMENT AND BY COUNTERPARTY SECTOR,1025
81.0,"In template 4.10, assets measured at strict LOCOM as well as their associated value adjustments shall be reported separately from assets under other measurement methods. Financial assets under strict LOCOM and financial assets under other measurement methods shall be reported as impaired assets in case they have credit-risk induced value adjustments as defined in paragraph 80 or impairment associated with them. Financial assets under strict LOCOM with market risk induced value adjustments as defined in paragraph 80 shall not be considered as impaired. Accumulated credit-risk induced and market-risk induced value adjustments shall be reported separately.",BREAKDOWN OF FINANCIAL ASSETS BY INSTRUMENT AND BY COUNTERPARTY SECTOR,661
82.0,"Under national GAAP based on BAD, the amount of general allowances for banking risk to be reported in the applicable templates shall only be the part that affects the carrying amount of debt instruments [BAD Article 37.2].",BREAKDOWN OF FINANCIAL ASSETS BY INSTRUMENT AND BY COUNTERPARTY SECTOR,222
83.0,Loans and advances other than those held for trading or trading assets shall be broken down by type of product and by counterparty sector for the carrying amount and by type of products only for the gross carrying amount.,BREAKDOWN OF NON-TRADING LOANS AND ADVANCES BY PRODUCT,221
84.0,"Balances receivable on demand classified as ‘Cash, cash balances at central banks and other demand deposits’ shall also be reported in this template independently of how they are measured.",BREAKDOWN OF NON-TRADING LOANS AND ADVANCES BY PRODUCT,188
85.0,"Loans and advances shall be allocated to the following products:
(a) ‘on demand (call) and short notice (current account)’ shall include balances receivable on demand (call), at short notice (by close of business on the day following that on which the demand was made), current accounts and similar balances including loans that are overnight deposits for the borrower (loans to be repaid by close of business on the day following that in which it was granted), regardless of their legal form. It shall also include ‘overdrafts’ that are debit balances on current account balances and compulsory reserves held at the central bank;
(b) ‘Credit card debt’ shall include credit granted either via delayed debit cards or via credit cards [ECB BSI Regulation];
(c) ‘Trade receivables’ shall include loans to other debtors granted on the basis of bills or other documents that give the right to receive the proceeds of transactions for the sale of goods or provision of services. This item shall include all factoring and similar transactions, like acceptances, outright purchase of trade receivables, forfaiting, discounting of invoice, bills of exchange, commercial papers and other claims where the reporting institution buys the trade receivables (both with and without recourse);
(d) ‘Finance leases’ shall include the carrying amount of finance lease receivables. Under IFRS ‘finance lease receivables’ are as defined in IAS 17;
(e) ‘Reverse repurchase loans’ shall include finance granted in exchange for securities or gold bought under repurchase agreements or borrowed under securities lending agreements as defined in paragraphs 183 and 184 of this Part;
(f) ‘Other term loans’ shall include debit balances with contractually fixed maturities or terms that are not included in other items;
(g) ‘Advances that are not loans’ shall include advances that cannot be classified as ‘loans’ according to the ECB BSI Regulation. This item shall include, among others, gross amounts receivable in respect of suspense items (such as funds that are awaiting investment, transfer, or settlement) and transit items (such as cheques and other forms of payment that have been sent for collection).",BREAKDOWN OF NON-TRADING LOANS AND ADVANCES BY PRODUCT,2186
86.0,"Loans and advances shall be classified on the basis of the collateral received as follows:
(a) ‘Loans collateralized by immovable property’ shall include loans and advances formally secured by residential or commercial immovable property collateral, independently of their loan/collateral ratio (commonly referred as ‘loan-to-value’) and the legal form of the collateral;
(b) ‘Other collateralized loans’ shall include loans and advances formally secured by collateral, independently of their loan/collateral ratio (commonly referred to as ‘loan-to-value’ (LTV) ratio) and the legal form of the collateral, other than ‘Loans collateralised by immovable property’. This collateral shall include pledges of securities, cash, and other collateral independently from the legal form of the collateral.",BREAKDOWN OF NON-TRADING LOANS AND ADVANCES BY PRODUCT,796
87.0,Loans and advances shall be classified based on the collateral and irrespective of the purpose of the loan. The carrying amount of loans and advances secured by more than one type of collateral shall be classified and reported as collateralised by immovable property where they are secured by immovable property regardless of whether they are also secured by other types of collateral.,BREAKDOWN OF NON-TRADING LOANS AND ADVANCES BY PRODUCT,385
88.0,"Loans and advances shall be classified on the basis of its purpose as:
(a) ‘Credit for consumption’ shall include loans granted mainly for the personal consumption of goods and services [ECB BSI Regulation];
(b) ‘Lending for house purchase’ shall include credit extended to households for the purpose of investing in houses for own use and rental, including building and refurbishments [ECB BSI Regulation].",BREAKDOWN OF NON-TRADING LOANS AND ADVANCES BY PRODUCT,407
89.0,Loans shall be classified on the basis of how they can be recovered. ‘Project finance loans’ shall include loans that meet the characteristics of specialised lending exposures as defined in Article 147(8) of CRR.,BREAKDOWN OF NON-TRADING LOANS AND ADVANCES BY PRODUCT,212
90.0,Gross carrying amount of loans and advances to non-financial corporations other than those included in the held for trading or trading assets portfolios shall be classified by sector of economic activities using NACE Codes on the basis of the principal activity of the counterparty.,BREAKDOWN OF NON-TRADING LOANS AND ADVANCES TO NON-FINANCIAL CORPORATIONS BY NACE CODES,282
91.0,The classification of the exposures incurred jointly by more than one obligor shall be done in accordance with paragraph 43 of Part 1 of this Annex.,BREAKDOWN OF NON-TRADING LOANS AND ADVANCES TO NON-FINANCIAL CORPORATIONS BY NACE CODES,148
92.0,Reporting of NACE codes shall be done with the first level of disaggregation (by ‘section’). Institutions shall report loans and advances to non-financial corporations which engage in financial or insurance activities in ‘K – Financial and insurance activities’.,BREAKDOWN OF NON-TRADING LOANS AND ADVANCES TO NON-FINANCIAL CORPORATIONS BY NACE CODES,262
93.0,"Under IFRS, financial assets subject to impairment shall include (i) financial assets at amortised cost, and (ii) financial assets at fair value through other comprehensive income. Under national GAAP based on BAD, financial assets subject to impairment shall include financial assets measured at a cost-based method, including under LOCOM. Depending on the specifications in each national GAAP, they may include (i) financial assets measured at fair value through equity, and (ii) financial assets under other measurement methods.",BREAKDOWN OF NON-TRADING LOANS AND ADVANCES TO NON-FINANCIAL CORPORATIONS BY NACE CODES,531
94.0,The carrying amount of debt instruments that are included in the accounting portfolios subject to impairment shall be reported in template 7.1 only if they are past due. Past-due instruments shall be allocated to the corresponding past-due buckets on the basis of their individual situation.,FINANCIAL ASSETS SUBJECT TO IMPAIRMENT THAT ARE PAST DUE,291
95.0,Accounting portfolios subject to impairment shall be defined as in paragraph 93 of this Part.,FINANCIAL ASSETS SUBJECT TO IMPAIRMENT THAT ARE PAST DUE,93
96.0,"Financial assets shall qualify as past due where any amount of principal, interest or fee has not been paid at the date it was due. Past due exposures shall be reported for their entire carrying amount. The carrying amounts of such assets shall be reported by impairment stages or impairment status in accordance with the applicable accounting standards and broken down according to the number of days of the oldest past due amount unpaid at the reference date.",FINANCIAL ASSETS SUBJECT TO IMPAIRMENT THAT ARE PAST DUE,461
97.0,"‘Deposits’ and the product breakdown shall be defined in the same way as in the ECB BSI Regulation and therefore, regulated savings deposits shall be classified in accordance with the ECB BSI Regulation and distributed according to the counterparty. In particular, non-transferable sight savings deposits, which although legally redeemable at demand are subject to significant penalties and restrictions and have features that are very close to overnight deposits, shall be classified as deposits redeemable at notice.",BREAKDOWN OF FINANCIAL LIABILITIES,518
98.0,"‘Debt securities issued’ shall be disaggregated into the following type of products:
(a) ‘Certificates of deposits’ shall be securities that enable the holders to withdraw funds from an account;
(b) ‘Asset backed securities’ according to Article 4(1)(61) of CRR;
(c) ‘Covered Bonds’ according to Article 129(1) of CRR;
(d) ‘Hybrid contracts’ shall comprise contracts with embedded derivatives;
(e) ‘Other debt securities issued’ shall include debt securities not recorded in the previous lines and distinguishes convertible compound financial instruments and non-convertible instruments.",BREAKDOWN OF FINANCIAL LIABILITIES,587
99.0,"‘Subordinated financial liabilities’ issued shall be treated in the same way as other financial liabilities incurred. Subordinated liabilities issued in the form of securities shall be classified as ‘Debt securities issued’, whereas subordinated liabilities in the form of deposits are classified as ‘Deposits’.",BREAKDOWN OF FINANCIAL LIABILITIES,311
100.0,Template 8.2 shall include the carrying amount of ‘Deposits’ and ‘Debt securities issued’ that meet the definition of subordinated debt classified by accounting portfolios. ‘Subordinated debt’ instruments provide a subsidiary claim on the issuing institution that can only be exercised after all claims with a higher status have been satisfied [ECB BSI Regulation].,BREAKDOWN OF FINANCIAL LIABILITIES,365
101.0,"‘Accumulated changes in fair value due to changes in own credit risk’ shall include all the said accumulative changes in fair value, regardless of whether they are recognised in profit or loss or in the other comprehensive income.",BREAKDOWN OF FINANCIAL LIABILITIES,230
102.0,"Off-balance sheet exposures shall include the off-balance sheet items listed in Annex I to CRR. In templates 9.1, 9.1.1 and 9.2 all off-balance sheet exposures as listed in Annex I to CRR shall be broken down in loan commitments, financial guarantees, and other commitments.","LOAN COMMITMENTS, FINANCIAL GUARANTEES AND OTHER COMMITMENTS",274
103.0,"Information on loan commitments, financial guarantees and other commitments given and received shall include both revocable and irrevocable commitments.","LOAN COMMITMENTS, FINANCIAL GUARANTEES AND OTHER COMMITMENTS",152
104.0,"Loan commitments, financial guarantees and other commitments given listed in Annex I to CRR may be instruments that are in the scope of IFRS 9 where they are measured at fair value through profit or loss, or where they are subject to the impairment requirements of IFRS 9, as well as instruments that are within the scope of IAS 37 or IFRS 4.","LOAN COMMITMENTS, FINANCIAL GUARANTEES AND OTHER COMMITMENTS",342
105.0,"Under IFRS, loan commitments, financial guarantees and other commitments given shall be reported in template 9.1.1 where any of the following conditions are met:
(a) they are subject to impairment requirements of IFRS 9;
(b) they are designated at fair value through profit or loss under IFRS 9;
(c) they are within the scope of IAS 37 or IFRS 4.","LOAN COMMITMENTS, FINANCIAL GUARANTEES AND OTHER COMMITMENTS",346
106.0,Liabilities that shall be recognised as credit losses for the financial guarantees and commitments given referred to under points (a) and (c) in paragraph 105 of this Part of this Annex shall be reported as provisions independently of the measurement criteria applied.,"LOAN COMMITMENTS, FINANCIAL GUARANTEES AND OTHER COMMITMENTS",268
107.0,"Institutions under IFRS shall report the nominal amount and provisions of instruments that are subject to the impairment requirements of IFRS 9 including those measured at initial cost less cumulative income recognised, broken down by impairment stages.","LOAN COMMITMENTS, FINANCIAL GUARANTEES AND OTHER COMMITMENTS",253
108.0,"Only the nominal amount of the commitment shall be reported in template 9.1.1 where a debt instrument includes both an on-balance sheet instrument and an off-balance sheet component. Where the reporting entity is unable to separately identify the expected credit losses on the on-balance sheet and off-balance components, the expected credit losses on the commitment shall be reported together with the accumulated impairment on the on-balance sheet component. Where the combined expected credit losses exceed the gross carrying amount of the debt instrument, the remaining balance of the expected credit losses shall be reported as a provision in the appropriate impairment stage in template 9.1.1 [IFRS 9.5.5.20 and IFRS 7.B8E].","LOAN COMMITMENTS, FINANCIAL GUARANTEES AND OTHER COMMITMENTS",730
109.0,Where a financial guarantee or a commitment to provide a loan at a below-market rate is measured in accordance with IFRS 9.4.2.1(d) and its loss allowance determined in accordance with IFRS 9.5.5 it shall be reported in the appropriate impairment stage.,"LOAN COMMITMENTS, FINANCIAL GUARANTEES AND OTHER COMMITMENTS",253
110.0,"Where loan commitments, financial guarantees and other commitments are measured at fair value in accordance with IFRS 9, institutions shall report in template 9.1.1 the nominal amount and accumulated negative changes in fair value due to credit risk of these financial guarantees and commitments in dedicated columns. ‘Accumulated negative changes in fair value due to credit risk’ shall be reported applying the criteria of paragraph 69 of this Part.","LOAN COMMITMENTS, FINANCIAL GUARANTEES AND OTHER COMMITMENTS",451
111.0,The nominal amount and provisions of other commitments or guarantees that are within the scope of IAS 37 or IFRS 4 shall be reported in dedicated columns.,"LOAN COMMITMENTS, FINANCIAL GUARANTEES AND OTHER COMMITMENTS",154
112.0,"Institutions under national GAAP based on BAD shall report in template 9.1 the nominal amount of commitments and financial guarantees referred to in paragraphs 102 and 103, as well as the amount of provisions required to be held against these off-balance sheet exposures.","LOAN COMMITMENTS, FINANCIAL GUARANTEES AND OTHER COMMITMENTS",271
113.0,"‘Loan commitments’ shall be firm commitments to provide credit under pre-specified terms and conditions, except those that are derivatives because they can be settled net in cash or by delivering or issuing another financial instrument. The following items of Annex I to CRR shall be classified as ‘Loan commitments’:
(a) ‘Forward deposits’;
(b) ‘Undrawn credit facilities’ which comprise agreements to ‘lend’ or provide ‘acceptance facilities’ under pre-specified terms and conditions.","LOAN COMMITMENTS, FINANCIAL GUARANTEES AND OTHER COMMITMENTS",486
